{
  "protocol_version": "agent.v1",
  "state": {
    "protocol_version": "agent.v1",
    "turn_id": "turn_interaction_1",
    "surface": "ai_chat",
    "mode": "chat",
    "agent_id": "ai_chat",
    "provider": "mock",
    "model": "mock-model",
    "messages": [
      {
        "role": "user",
        "content": "Help me choose.",
        "metadata": {}
      }
    ],
    "tools": [],
    "metadata": {},
    "max_tool_rounds": 4,
    "round": 1,
    "pending_tool_calls": [],
    "pending_interaction": {
      "protocol_version": "agent.v1",
      "interaction_id": "interaction_1",
      "kind": "choice",
      "mode": "one_tap",
      "status": "pending",
      "title": "Choose a plan",
      "prompt": "Select the plan to continue with.",
      "options": [
        {
          "id": "safe",
          "label": "Safe",
          "description": "",
          "metadata": {}
        },
        {
          "id": "fast",
          "label": "Fast",
          "description": "",
          "metadata": {}
        }
      ],
      "response_schema": { "type": "object" },
      "payload": {},
      "metadata": {},
      "resume": { "kind": "chat_turn" },
      "created_at": "2026-07-23T10:00:00Z"
    },
    "tool_execution": "client"
  },
  "tool_results": [],
  "interaction_response": {
    "protocol_version": "agent.v1",
    "interaction_id": "interaction_1",
    "action": "submit",
    "value": { "option_id": "safe" },
    "responded_by": "user-1",
    "responded_at": "2026-07-23T10:01:00Z",
    "metadata": {}
  }
}
